### ISSUE TITLE
Investigate current performance bottle-necks

### ISSUE THREAD

**Issue by pirog-spb** [edgecomllc/eupf#367]
# Definition of done
- [ ] Retest eupf v0.3.5(ongoing) performance and find out bottlenecks:
- [ ] highloaded userspace processes (CPU)
- [ ] highloaded kernelspace processes (CPU)

**Comment by pirog-spb** [comment]
#363 test analysis:

- there is fib_lookup logs in tracepipe

**Comment by ewdss** [comment]
@pirog-spb Please check and reivew this issue: 
https://github.com/edgecomllc/things-for-demo/issues/4

Something strange has happened with performance. Check table in the issue above and ask @marknefedov for the details.

**Comment by pirog-spb** [comment]
@mbaran0v Considering latency check util: 

### 1. eUPF is pinged by wrong IP

Endpoint IP should be used instead of Cluster IP(service).

Simple workarround: Add record to hosts file in ue pod `echo '10.233.64.1 eupf' >> /etc/hosts`

### 2. 8.8.8.8 icmp reply blocked by rp_filter

Cause is still not clear but sometime rp_filter starts to block 8.8.8.8 icmp replies.

See `iptables -L -v -traw --line-numbers | grep rpfilter`

Workarround: add UE subnet in allowed list in order to calico add this subnet to rp_filter skip list

1. Add `workloadSourceSpoofing: Any` to FelixConfiguration CRD
2. Add `cni.projectcalico.org/allowedSourcePrefixes: '["10.245.0.0/24"]'` annotation to eupf pod spec in deployment

### 3. 8.8.8.8 reply goes back to network

Usually looks like this:
```
sudo tcpdump -i any -n icmp and host 8.8.8.8
11:39:23.122063 cali551c75f2562 In  IP 10.245.0.2 > 8.8.8.8: ICMP echo request, id 27592, seq 35886, length 36
11:39:23.122084 ens3  Out IP 188.120.232.247 > 8.8.8.8: ICMP echo request, id 56397, seq 35886, length 36
11:39:23.135252 ens3  In  IP 8.8.8.8 > 188.120.232.247: ICMP echo reply, id 56397, seq 35886, length 36
11:39:23.135454 cali551c75f2562 Out IP 8.8.8.8 > 10.245.0.2: ICMP echo reply, id 27592, seq 35886, length 36
```

But sometimes something goes wrong:
```
sudo tcpdump -i any -n icmp and host 8.8.8.8
19:56:54.919040 cali551c75f2562 In  IP 10.245.0.7 > 8.8.8.8: ICMP echo request, id 42584, seq 45375, length 36
19:56:54.919092 ens3  Out IP 188.120.232.247 > 8.8.8.8: ICMP echo request, id 48751, seq 45375, length 36
19:56:54.934594 ens3  In  IP 8.8.8.8 > 188.120.232.247: ICMP echo reply, id 48751, seq 45375, length 36
19:56:54.934646 ens3  Out IP 8.8.8.8 > 10.245.0.7: ICMP echo reply, id 42584, seq 45375, length 36
```

**Comment by pirog-spb** [comment]
Any kind of ebpf program optimizations have no effect actually. According to profiling - ebpf program execution time not so valuable.

Lets check packet loss problem instead.
```
00:31:27.695639 calib99c321a844 In  IP 10.245.0.3 > 10.233.78.167: ICMP echo request, id 50, seq 9, length 64
00:31:27.695656 cali0a141481ae3 Out IP 10.245.0.3 > 10.233.78.167: ICMP echo request, id 50, seq 9, length 64
00:31:27.695676 cali0a141481ae3 In  IP 10.233.78.167 > 10.245.0.3: ICMP echo reply, id 50, seq 9, length 64
00:31:27.695686 calib99c321a844 Out IP 10.233.78.167 > 10.245.0.3: ICMP echo reply, id 50, seq 9, length 64

00:31:28.694293 calib99c321a844 In  IP 10.245.0.3 > 10.233.78.167: ICMP echo request, id 50, seq 10, length 64
00:31:28.694315 cali0a141481ae3 Out IP 10.245.0.3 > 10.233.78.167: ICMP echo request, id 50, seq 10, length 64
00:31:28.694335 cali0a141481ae3 In  IP 10.233.78.167 > 10.245.0.3: ICMP echo reply, id 50, seq 10, length 64
00:31:28.694352 ens3  Out IP 10.233.78.167 > 10.245.0.3: ICMP echo reply, id 50, seq 10, length 64
```

Here we can see 2 sequential pings. Surprisingly, but some ping replies go to internet instead of ping client...

**Comment by pirog-spb** [comment]
```
iperf3 -c 10.233.78.167 --bind-dev uesimtun0
Connecting to host 10.233.78.167, port 5201
[  5] local 10.245.0.3 port 41482 connected to 10.233.78.167 port 5201
[ ID] Interval           Transfer     Bitrate         Retr  Cwnd
[  5]   0.00-1.00   sec  24.2 MBytes   203 Mbits/sec   64    109 KBytes
[  5]   1.00-2.00   sec  21.2 MBytes   178 Mbits/sec   23    121 KBytes
[  5]   2.00-3.00   sec  17.5 MBytes   147 Mbits/sec    9   86.9 KBytes
[  5]   3.00-4.00   sec  17.5 MBytes   147 Mbits/sec   17    116 KBytes
[  5]   4.00-5.00   sec  15.0 MBytes   126 Mbits/sec    6    104 KBytes
[  5]   5.00-6.00   sec  0.00 Bytes  0.00 bits/sec    2   1.32 KBytes
[  5]   6.00-7.00   sec  0.00 Bytes  0.00 bits/sec    1   1.32 KBytes
[  5]   7.00-8.00   sec  0.00 Bytes  0.00 bits/sec    0   1.32 KBytes
[  5]   8.00-9.00   sec  0.00 Bytes  0.00 bits/sec    1   1.32 KBytes
[  5]   9.00-10.00  sec  0.00 Bytes  0.00 bits/sec    0   1.32 KBytes
- - - - - - - - - - - - - - - - - - - - - - - - -
[ ID] Interval           Transfer     Bitrate         Retr
[  5]   0.00-10.00  sec  95.5 MBytes  80.1 Mbits/sec  123             sender
[  5]   0.00-10.00  sec  92.7 MBytes  77.8 Mbits/sec                  receiver

iperf Done.
```

And in case of iperf test there are packets which go to internet as well
```
sudo tcpdump -i ens3 -n host 10.245.0.3

00:39:11.924223 IP 10.233.78.167.5201 > 10.245.0.3.50312: Flags [S.], seq 4034347773, ack 2350118785, win 62643, options [mss 8961,sackOK,TS val 1746473751 ecr 1081791584,nop,wscale 7], length 0
00:39:12.932114 IP 10.233.78.167.5201 > 10.245.0.3.50312: Flags [S.], seq 4034347773, ack 2350118785, win 62643, options [mss 8961,sackOK,TS val 1746474759 ecr 1081791584,nop,wscale 7], length 0
00:39:12.932569 IP 10.233.78.167.5201 > 10.245.0.3.50312: Flags [S.], seq 4034347773, ack 2350118785, win 62643, options [mss 8961,sackOK,TS val 1746474759 ecr 1081791584,nop,wscale 7], length 0
00:39:14.948128 IP 10.233.78.167.5201 > 10.245.0.3.50312: Flags [S.], seq 4034347773, ack 2350118785, win 62643, options [mss 8961,sackOK,TS val 1746476775 ecr 1081791584,nop,wscale 7], length 0
00:39:14.952177 IP 10.233.78.167.5201 > 10.245.0.3.50312: Flags [S.], seq 4034347773, ack 2350118785, win 62643, options [mss 8961,sackOK,TS val 1746476779 ecr 1081791584,nop,wscale 7], length 0
00:39:19.046901 IP 10.233.78.167.5201 > 10.245.0.3.50312: Flags [S.], seq 4034347773, ack 2350118785, win 62643, options [mss 8961,sackOK,TS val 1746480873 ecr 1081791584,nop,wscale 7], length 0
00:39:27.999046 IP 10.233.78.167.5201 > 10.245.0.3.41482: Flags [.], ack 312895181, win 6507, options [nop,nop,TS val 1746489826 ecr 1081807651], length 0
00:39:27.999075 IP 10.233.78.167.5201 > 10.245.0.3.41482: Flags [.], ack 2697, win 6507, options [nop,nop,TS val 1746489826 ecr 1081807651], length 0
00:39:27.999122 IP 10.233.78.167.5201 > 10.245.0.3.41482: Flags [.], ack 5393, win 6507, options [nop,nop,TS val 1746489826 ecr 1081807652], length 0
00:39:27.999172 IP 10.233.78.167.5201 > 10.245.0.3.41482: Flags [.], ack 8089, win 6507, options [nop,nop,TS val 1746489826 ecr 1081807652], length 0
00:39:27.999258 IP 10.233.78.167.5201 > 10.245.0.3.41482: Flags [.], ack 10785, win 6507, options [nop,nop,TS val 1746489826 ecr 1081807652], length 0
00:39:27.999304 IP 10.233.78.167.5201 > 10.245.0.3.41482: Flags [.], ack 13481, win 6507, options [nop,nop,TS val 1746489826 ecr 1081807652], length 0
00:39:27.999350 IP 10.233.78.167.5201 > 10.245.0.3.41482: Flags [.], ack 16177, win 6507, options [nop,nop,TS val 1746489826 ecr 1081807652], length 0
00:39:27.999928 IP 10.233.78.167.5201 > 10.245.0.3.41482: Flags [.], ack 18873, win 6507, options [nop,nop,TS val 1746489826 ecr 1081807652], length 0
00:39:27.999994 IP 10.233.78.167.5201 > 10.245.0.3.41482: Flags [.], ack 21569, win 6507, options [nop,nop,TS val 1746489827 ecr 1081807652], length 0
00:39:28.001594 IP 10.233.78.167.5201 > 10.245.0.3.41482: Flags [.], ack 41789, win 6507, options [nop,nop,TS val 1746489828 ecr 1081807652], length 0
00:39:28.003228 IP 10.233.78.167.5201 > 10.245.0.3.41482: Flags [.], ack 48529, win 6507, options [nop,nop,TS val 1746489830 ecr 1081807654], length 0
00:39:28.003265 IP 10.233.78.167.5201 > 10.245.0.3.41482: Flags [.], ack 52573, win 6507, options [nop,nop,TS val 1746489830 ecr 1081807655], length 0
00:39:28.007043 IP 10.233.78.167.5201 > 10.245.0.3.41482: Flags [.], ack 99753, win 6507, options [nop,nop,TS val 1746489834 ecr 1081807657], length 0
00:39:28.036980 IP 10.233.78.167.5201 > 10.245.0.3.41482: Flags [.], ack 102449, win 6507, options [nop,nop,TS val 1746489863 ecr 1081807697], length 0
00:39:28.080090 IP 10.233.78.167.5201 > 10.245.0.3.41482: Flags [.], ack 103797, win 6507, options [nop,nop,TS val 1746489907 ecr 1081807697], length 0
00:39:28.253640 IP 10.233.78.167.5201 > 10.245.0.3.41482: Flags [.], ack 103797, win 6507, options [nop,nop,TS val 1746490080 ecr 1081807697,nop,nop,sack 1 {4294964601:4294965949}], length 0
00:39:28.712649 IP 10.233.78.167.5201 > 10.245.0.3.41482: Flags [.], ack 103797, win 6507, options [nop,nop,TS val 1746490539 ecr 1081807697,nop,nop,sack 1 {4294964601:4294965949}], length 0
00:39:29.572926 IP 10.233.78.167.5201 > 10.245.0.3.41482: Flags [.], ack 103797, win 6507, options [nop,nop,TS val 1746491399 ecr 1081807697,nop,nop,sack 1 {4294964601:4294965949}], length 0
00:39:31.300594 IP 10.233.78.167.5201 > 10.245.0.3.41482: Flags [.], ack 103797, win 6507, options [nop,nop,TS val 1746493127 ecr 1081807697,nop,nop,sack 1 {4294964601:4294965949}], length 0
00:39:33.151079 IP 10.233.78.167.5201 > 10.245.0.3.41482: Flags [F.], seq 0, ack 103797, win 6507, options [nop,nop,TS val 1746494978 ecr 1081807697], length 0
00:39:33.151138 IP 10.233.78.167.5201 > 10.245.0.3.50312: Flags [P.], seq 5:6, ack 144, win 490, options [nop,nop,TS val 1746494978 ecr 1081812811], length 1
00:39:33.356081 IP 10.233.78.167.5201 > 10.245.0.3.41482: Flags [F.], seq 0, ack 103797, win 6507, options [nop,nop,TS val 1746495183 ecr 1081807697], length 0
00:39:33.360080 IP 10.233.78.167.5201 > 10.245.0.3.50312: Flags [P.], seq 5:6, ack 144, win 490, options [nop,nop,TS val 1746495187 ecr 1081812811], length 1
```

**Comment by pirog-spb** [comment]
`rtmon` shows that route to UE subnet is continuesly being updated

```
rtmon file rtmon.log route

ip monitor file rtmon.log

Timestamp: Mon Sep  4 17:21:41 2023 452522 us
10.245.0.0/16 via 10.233.64.1 dev calib99c321a844 proto bird
Timestamp: Mon Sep  4 17:21:47 2023 998333 us
Deleted 10.245.0.0/16 via 10.233.64.1 dev calib99c321a844 proto bird
Timestamp: Mon Sep  4 17:21:49 2023 892429 us
10.245.0.0/16 via 10.233.64.1 dev calib99c321a844 proto bird
Timestamp: Mon Sep  4 17:21:57 2023 998246 us
Deleted 10.245.0.0/16 via 10.233.64.1 dev calib99c321a844 proto bird
Timestamp: Mon Sep  4 17:22:01 2023 804770 us
10.245.0.0/16 via 10.233.64.1 dev calib99c321a844 proto bird
Timestamp: Mon Sep  4 17:22:07 2023 997936 us
Deleted 10.245.0.0/16 via 10.233.64.1 dev calib99c321a844 proto bird
Timestamp: Mon Sep  4 17:22:13 2023 516527 us
10.245.0.0/16 via 10.233.64.1 dev calib99c321a844 proto bird
Timestamp: Mon Sep  4 17:22:17 2023 998755 us
Deleted 10.245.0.0/16 via 10.233.64.1 dev calib99c321a844 proto bird
Timestamp: Mon Sep  4 17:22:25 2023 596133 us
10.245.0.0/16 via 10.233.64.1 dev calib99c321a844 proto bird
```

**Comment by pirog-spb** [comment]
Calico log shows us that BGP peer goes up and down:
```
bird: Node_10_233_64_1: Starting
bird: Node_10_233_64_1: State changed to start
bird: Node_10_233_64_1: Connected to table master
bird: Node_10_233_64_1: State changed to feed
bird: Node_10_233_64_1: State changed to up
bird: Node_10_233_64_1: State changed to stop
bird: Node_10_233_64_1: State changed to down
bird: Node_10_233_64_1: Starting
bird: Node_10_233_64_1: State changed to start
bird: Node_10_233_64_1: Connected to table master
bird: Node_10_233_64_1: State changed to feed
bird: Node_10_233_64_1: State changed to up
2023-09-04 15:17:03.398 [INFO][927] felix/route_table.go 931: Remove old route dest=10.245.0.0/16 ifaceName="calib99c321a844" ifaceRegex="^cali.*" ipVersion=0x4 routeProblems=[]string{"unexpected route", "incorrect protocol", "incorrect gateway"} tableIndex=0
2023-09-04 15:17:03.398 [INFO][927] felix/conntrack.go 90: Removing conntrack flows ip=10.245.0.0
bird: Node_10_233_64_1: State changed to stop
bird: Node_10_233_64_1: State changed to down
```

**Comment by pirog-spb** [comment]
eUPF ebpf program flamegraph

![Image](https://github.com/edgecomllc/eupf/assets/20152142/323232ac-f9dc-4637-a7aa-538d92021cfa)

**Comment by pirog-spb** [comment]
Initial flamegraph:



![Image](https://github.com/edgecomllc/eupf/assets/20152142/bb475ccc-1814-43bc-a115-440b226dd555)

**Comment by pirog-spb** [comment]
Flamegraph source

![Image](https://github.com/edgecomllc/eupf/assets/20152142/ae009adb-316e-48de-94a8-61a3962a895a)
