### ISSUE TITLE
Deploy eUPF with OAI core

### ISSUE THREAD

**Issue by pirog-spb** [edgecomllc/eupf#473]
- [x] Try to connect eUPF with OAI in docker-compose
- [x] **Find out how to configure OAI SMF connection to UPF (!)**
- [x] Compare signalling messages with and without eUPF
- [ ] Research OAI site, habr, medium, reddit, linkedin to get mode info about deployment of OAI
- [x] Find compatible versions of UE-gNB-Core components
- [x] **Verify 0-scenario (!)**

**Comment by PapaySail** [comment]
OAI Full Stack 5G-NR L2 simulation with containers and a proxy started is in #340 
There is config parameters in docker-compose.yaml:
```yaml
    oai-smf:
        container_name: "l2sim-oai-smf"
        image: oaisoftwarealliance/oai-smf:v1.5.0
        environment:

            - UPF_IPV4_ADDRESS=192.168.71.134
            - UPF_FQDN_0=oai-spgwu
            - DISCOVER_UPF=yes
            - UE_MTU=1500
            # Only one slice is defined (1, 0xFFFFFF)
            - DNN_NI0=oai
            - TYPE0=IPv4
            - DNN_RANGE0=12.1.1.2 - 12.1.1.127
            - NSSAI_SST0=1

    oai-spgwu:
        container_name: "l2sim-oai-spgwu"
        image: oaisoftwarealliance/oai-spgwu-tiny:v1.5.0
        environment:
            - TZ=Europe/Paris
            - SGW_INTERFACE_NAME_FOR_S1U_S12_S4_UP=eth0
            - SGW_INTERFACE_NAME_FOR_SX=eth0
            - PGW_INTERFACE_NAME_FOR_SGI=eth0
            - NETWORK_UE_NAT_OPTION=yes
            - NETWORK_UE_IP=12.1.1.0/24
            - ENABLE_5G_FEATURES=yes
            - REGISTER_NRF=yes
            - USE_FQDN_NRF=yes
            - UPF_FQDN_5G=oai-spgwu
            - NRF_IPV4_ADDRESS=192.168.71.130
            - NRF_FQDN=oai-nrf
            # Only one slice is defined (1, 0xFFFFFF)
            - NSSAI_SST_0=1
            - NSSAI_SD_0=0xffffff
            - DNN_0=oai
        depends_on:
            - oai-nrf
            - oai-smf
        cap_add:
            - NET_ADMIN
            - SYS_ADMIN
        cap_drop:
            - ALL
        privileged: true
        networks:
            public_net:
                ipv4_address: 192.168.71.134
            traffic_net:
                ipv4_address: 192.168.72.134

```

**Comment by PapaySail** [comment]
Re-checking how it works with original OAI  spgwu
I see - it use host's ens3 interface and IP addr for GTP tunnel

<details><summary>gNB's log:</summary>
<p>


```ruby
l2sim-oai-gnb  | 2023-11-09T06:39:12.767011327Z 4355918.969572 00000001 [GNB_APP] I default drx 0
l2sim-oai-gnb  | 2023-11-09T06:39:12.767047344Z 4355918.969586 00000001 [GNB_APP] I [gNB 0] gNB_app_register for instance 0
l2sim-oai-gnb  | 2023-11-09T06:39:12.767051606Z 4355918.969591 00000001 [UTIL] I Creating thread TASK_SCTP with affinity -1 and priority 50
l2sim-oai-gnb  | 2023-11-09T06:39:12.775436501Z 4355918.977871 00000001 [ITTI] I Created Posix thread TASK_SCTP
l2sim-oai-gnb  | 2023-11-09T06:39:12.775560259Z 4355918.978110 00000001 [X2AP] I X2AP is disabled.
l2sim-oai-gnb  | 2023-11-09T06:39:12.775683650Z 4355918.978240 00000001 [NGAP] D Configuration in the file: ens3.
l2sim-oai-gnb  | 2023-11-09T06:39:12.775725494Z 4355918.978297 00000001 [NGAP] D Configuration in the file: 188.120.232.247.
l2sim-oai-gnb  | 2023-11-09T06:39:12.775784022Z 4355918.978345 00000001 [UTIL] I Creating thread TASK_NGAP with affinity -1 and priority 50
l2sim-oai-gnb  | 2023-11-09T06:39:12.786292579Z 4355918.988703 00000016 [NGAP] I Starting NGAP layer
l2sim-oai-gnb  | 2023-11-09T06:39:12.786401141Z 4355918.988957 00000001 [ITTI] I Created Posix thread TASK_NGAP
l2sim-oai-gnb  | 2023-11-09T06:39:12.786464152Z 4355918.989021 00000001 [UTIL] I Creating thread TASK_GNB_APP with affinity -1 and priority 50
l2sim-oai-gnb  | 2023-11-09T06:39:12.787762871Z 4355918.989629 00000016 [NGAP] I Registered new gNB[0] and macro gNB id 3584
l2sim-oai-gnb  | 2023-11-09T06:39:12.787771276Z 4355918.989642 00000016 [NGAP] I [gNB 0] check the amf registration state
l2sim-oai-gnb  | 2023-11-09T06:39:12.789809407Z 4355918.992035 00000016 [NGAP] I 3584 -> 0000e000
l2sim-oai-gnb  | 2023-11-09T06:39:12.792499653Z 4355918.995019 00000016 [NGAP] I servedGUAMIs.list.count 1
l2sim-oai-gnb  | 2023-11-09T06:39:12.792521343Z 4355918.995038 00000016 [NGAP] I PLMNSupportList.list.count 1
l2sim-oai-gnb  | 2023-11-09T06:39:12.792525847Z 4355918.995041 00000016 [NGAP] I PLMNSupportList.list.count 1
l2sim-oai-gnb  | 2023-11-09T06:39:12.798248220Z 4355918.999736 00000001 [ITTI] I Created Posix thread TASK_GNB_APP
l2sim-oai-gnb  | 2023-11-09T06:39:12.798277941Z 4355918.999795 00000001 [NR_RRC] I Creating NR RRC gNB Task, that will also create TASKS
l2sim-oai-gnb  | 2023-11-09T06:39:12.798282055Z 4355918.999810 00000001 [UTIL] I Creating thread TASK_RRC_GNB with affinity -1 and priority 50
l2sim-oai-gnb  | 2023-11-09T06:39:12.800766216Z 4355919.000773 00000019 [GNB_APP] I [gNB 0] Received NGAP_REGISTER_GNB_CNF: associated AMF 1
l2sim-oai-gnb  | 2023-11-09T06:39:12.807547503Z 4355919.009281 00000001 [ITTI] I Created Posix thread TASK_RRC_GNB
l2sim-oai-gnb  | 2023-11-09T06:39:12.807815026Z 4355919.009454 00000001 [GTPU] I Configuring GTPu
l2sim-oai-gnb  | 2023-11-09T06:39:12.807821623Z 4355919.009525 00000001 [GTPU] I SA mode
l2sim-oai-gnb  | 2023-11-09T06:39:12.807842350Z 4355919.010165 00000001 [GTPU] I Configuring GTPu address : 188.120.232.247, port : 2152
l2sim-oai-gnb  | 2023-11-09T06:39:12.807846539Z 4355919.010203 00000001 [GTPU] I Initializing UDP for local address 188.120.232.247 with port 2152
l2sim-oai-gnb  | 2023-11-09T06:39:12.807850128Z 4355919.010243 0000001c [NR_RRC] I Entering main loop of NR_RRC message task
l2sim-oai-gnb  | 2023-11-09T06:39:12.807853418Z 4355919.010264 0000001c [NR_RRC] I Received F1 Setup Request from gNB_DU 3584 (gnb-l2sim-vnf) on assoc_id 0
l2sim-oai-gnb  | 2023-11-09T06:39:12.807856854Z 4355919.010284 00000001 [GTPU] I Created gtpu instance id: 101

```


</p>
</details>

**Comment by PapaySail** [comment]
Well, when our eupf container started, th interface is `l2sim-public`:
<details><summary>Details</summary>
<p>

```ruby
sergo@edgecom:~/gitlab/openairinterface5g/ci-scripts/yaml_files/5g_l2sim_tdd$ ip r get 192.168.71.134
192.168.71.134 dev l2sim-public src 192.168.71.129 uid 1002
    cache
sergo@edgecom:~/gitlab/openairinterface5g/ci-scripts/yaml_files/5g_l2sim_tdd$ ip r |grep  192.168.71
192.168.71.128/26 dev l2sim-public proto kernel scope link src 192.168.71.129
```

</p>
</details> 

So, I'll put it in the gNb config file:
``` ruby
nano ../../conf_files/gnb.sa.band78.106prb.l2sim.conf
    NETWORK_INTERFACES :
    {
        GNB_INTERFACE_NAME_FOR_NG_AMF            = "ens3";
        GNB_IPV4_ADDRESS_FOR_NG_AMF              = "188.120.232.247";
        GNB_INTERFACE_NAME_FOR_NGU               = "l2sim-public";
        GNB_IPV4_ADDRESS_FOR_NGU                 = "192.168.71.129";
        GNB_PORT_FOR_NGU                         = 2152; # Spec 2152
    };

sudo docker-compose up -d oai-gnb
```

Resulting log:
<details><summary>Details</summary>
<p>

```ruby
sudo docker-compose logs -tf  oai-gnb
...
l2sim-oai-gnb  | 2023-11-11T09:03:50.722368492Z 4537396.923772 00000001 [GTPU] I Configuring GTPu address : 192.168.71.129, port : 2152
l2sim-oai-gnb  | 2023-11-11T09:03:50.722387700Z 4537396.923779 00000001 [GTPU] I Initializing UDP for local address 192.168.71.129 with port 2152
l2sim-oai-gnb  | 2023-11-11T09:03:50.722391377Z 4537396.923834 00000001 [GTPU] I Created gtpu instance id: 101
l2sim-oai-gnb  | 2023-11-11T09:03:50.722394623Z 4537396.923841 00000001 [UTIL] I Creating thread TASK_GTPV1_U with affinity -1 and priority 50
l2sim-oai-gnb  | 2023-11-11T09:03:50.730501635Z 4537396.932866 00000001 [ITTI] I Created Posix thread TASK_GTPV1_U

```

</p>
</details>

**Comment by pirog-spb** [comment]
To make smf connect upf - disable UPF discovery:

```
    oai-smf:
        container_name: "l2sim-oai-smf"
        image: oaisoftwarealliance/oai-smf:v1.5.0
        environment:
            - ...
            - DISCOVER_UPF=no
            - ...

```

After that SMF try to connect to UPF. eUPF doesn't send Recovery Timestamp in response...

**Comment by pirog-spb** [comment]
I've added Recovery Timestamp in response in the linked branch. Now it's ok. @PapaySail you can go further

**Comment by PapaySail** [comment]
- DISCOVER_UPF=no
OK. SMF-UPF sessioin established

<details><summary>Logs</summary>
<p>

sudo docker-compose logs -n 20 edgecom-upf
```ruby
eupf  | 2023/11/22 07:43:23 INF Got Association Setup Request from: 192.168.71.133.
eupf  |
eupf  |
eupf  | 2023/11/22 07:43:23 INF
eupf  | Association Setup Request:
eupf  |   Node ID: 192.168.71.133
eupf  |   Recovery Time: 2023-11-22 07:43:23 +0000 UTC
eupf  |
eupf  |
eupf  | 2023/11/22 07:43:23 WRN Association Setup Request with NodeID: 192.168.71.133 from: 192.168.71.133 already exists
eupf  | 2023/11/22 07:43:23 WRN Session retention is not yet implemented
eupf  | 2023/11/22 07:43:23 INF Saving new association: &{ID:192.168.71.133 Addr:192.168.71.133 NextSessionID:1 NextSequenceID:1 Sessions:map[] HeartbeatRetries:0 cancelRetries:<nil>}
``` 

sudo docker-compose logs  oai-smf |less
```ruby
l2sim-oai-smf  | [2023-11-22T07:43:23.774539] [smf] [smf_app] [debug] Start a PFCP Association procedure with an UPF
l2sim-oai-smf  | [2023-11-22T07:43:23.774556] [smf] [sbi_srv] [info ] HTTP2 server started
l2sim-oai-smf  | [2023-11-22T07:43:23.774565] [smf] [smf_app] [debug] Resolving an FQDN/IP Addr for an UPF node
l2sim-oai-smf  | [2023-11-22T07:43:23.774583] [smf] [smf_app] [debug] Resolving an IP address (name 192.168.71.134)
l2sim-oai-smf  | [2023-11-22T07:43:23.774589] [smf] [smf_app] [debug] Reverse Resolving Try #0
l2sim-oai-smf  | [2023-11-22T07:43:23.776579] [smf] [smf_app] [debug] Resolve IP Addr 192.168.71.134, FQDN eupf.l2sim-oai-public-net
l2sim-oai-smf  | [2023-11-22T07:43:23.777056] [smf] [smf_n4 ] [info ] handle_receive(16 bytes)
l2sim-oai-smf  | [2023-11-22T07:43:23.777101] [smf] [smf_n4 ] [debug] handle_receive_pfcp_msg msg type 1 length 12
l2sim-oai-smf  | [2023-11-22T07:43:23.780294] [smf] [smf_n4 ] [info ] handle_receive(36 bytes)
l2sim-oai-smf  | [2023-11-22T07:43:23.780356] [smf] [smf_n4 ] [debug] handle_receive_pfcp_msg msg type 6 length 32
l2sim-oai-smf  | [2023-11-22T07:43:23.780368] [smf] [smf_n4 ] [info ] Received N4 ASSOCIATION SETUP RESPONSE from an UPF
l2sim-oai-smf  | [2023-11-22T07:43:23.780381] [smf] [smf_n4 ] [info ] Received N4 ASSOCIATION SETUP RESPONSE
l2sim-oai-smf  | [2023-11-22T07:43:23.780388] [smf] [smf_app] [debug] Resolving an FQDN/IP Addr for an UPF node
l2sim-oai-smf  | [2023-11-22T07:43:23.780404] [smf] [smf_app] [debug] Resolving an IP address (name 192.168.71.134)
l2sim-oai-smf  | [2023-11-22T07:43:23.780424] [smf] [smf_app] [debug] Reverse Resolving Try #0
l2sim-oai-smf  | [2023-11-22T07:43:23.780859] [smf] [smf_app] [debug] Resolve IP Addr 192.168.71.134, FQDN eupf.l2sim-oai-public-net
l2sim-oai-smf  | [2023-11-22T07:43:23.780873] [smf] [smf_app] [info ] Cannot connect UPF to other nodes in the graph as it has no profile, just add the node
l2sim-oai-smf  | [2023-11-22T07:43:23.780875] [smf] [smf_app] [info ] Assume that the UPF has a N3 and a N6 interface.
l2sim-oai-smf  | [2023-11-22T07:43:23.780884] [smf] [smf_app] [debug] Successfully added UPF node: , (2252843200)
l2sim-oai-smf  | [2023-11-22T07:43:23.780892] [smf] [smf_app] [debug] Successfully added UPF graph edge for : N3()
l2sim-oai-smf  | [2023-11-22T07:43:23.780905] [smf] [smf_app] [debug] Successfully added UPF graph edge for : N6()
l2sim-oai-smf  | [2023-11-22T07:43:23.780912] [smf] [smf_app] [debug] UPF graph
l2sim-oai-smf  | [2023-11-22T07:43:23.780915] [smf] [smf_app] [debug] * 2252843200 --> N3(), N6(),
l2sim-oai-smf  |
l2sim-oai-smf  |
l2sim-oai-smf  | [2023-11-22T07:43:23.780918] [smf] [smf_app] [debug] NF instance info
l2sim-oai-smf  | [2023-11-22T07:43:23.780920] [smf] [smf_app] [debug]   Instance ID:
l2sim-oai-smf  | [2023-11-22T07:43:23.780922] [smf] [smf_app] [debug]   Instance name:
l2sim-oai-smf  | [2023-11-22T07:43:23.780924] [smf] [smf_app] [debug]   Instance type: UPF
l2sim-oai-smf  | [2023-11-22T07:43:23.780926] [smf] [smf_app] [debug]   Status:
l2sim-oai-smf  | [2023-11-22T07:43:23.780928] [smf] [smf_app] [debug]   HeartBeat timer: 0
l2sim-oai-smf  | [2023-11-22T07:43:23.780930] [smf] [smf_app] [debug]   Priority: 0
l2sim-oai-smf  | [2023-11-22T07:43:23.780932] [smf] [smf_app] [debug]   Capacity: 0
```

</p>
</details> 

sudo docker-compose up -d oai-gnb
sudo docker-compose up -d proxy oai-nr-ue0
OK at eupf:
sudo docker-compose logs -n 20 edgecom-upf
```ruby
eupf  | ESC[90m2023/11/22 08:05:54ESC[0m ESC[32mINFESC[0m Got Session Establishment Request from: 192.168.71.133.
eupf  | ESC[90m2023/11/22 08:05:54ESC[0m ESC[32mINFESC[0m
eupf  | Session Establishment Request:
eupf  |   CreatePDR ID: 1
eupf  |     Outer Header Removal: 0
eupf  |     FAR ID: 1
eupf  |     Source Interface: 0
eupf  |     TEID: 0
eupf  |     Ipv4: <nil>
eupf  |     Ipv6: <nil>
eupf  |     UE IPv4 Address: 12.1.1.3
eupf  |   CreateFAR ID: 1
eupf  |     Apply Action: [2]
eupf  |     Forwarding Parameters:
eupf  |
eupf  |
eupf  | ESC[90m2023/11/22 08:05:54ESC[0m ESC[32mINFESC[0m WARN: No OuterHeaderCreation
eupf  | ESC[90m2023/11/22 08:05:54ESC[0m ESC[32mINFESC[0m Saving FAR info to session: 1, {Action:2 OuterHeaderCreation:0 Teid:0 RemoteIP:0 LocalIP:2252843200 TransportLevelMarking:0}
eupf  | ESC[90m2023/11/22 08:05:54ESC[0m ESC[32mINFESC[0m Session Establishment Request from 192.168.71.133 accepted.
```

but interface oaitun_ue1  is down  🤷‍♂️
```ruby
sergo@edgecom:~/gitlab/openairinterface5g/ci-scripts/yaml_files/5g_l2sim_tdd$ ip a |grep oai
8050: br-oainfapi-n6: <BROADCAST,MULTICAST,UP,LOWER_UP> mtu 1500 qdisc noqueue state UP group default
    inet 10.100.250.1/24 brd 10.100.250.255 scope global br-oainfapi-n6
8058: veth1236506@if8057: <BROADCAST,MULTICAST,UP,LOWER_UP> mtu 1500 qdisc noqueue master br-oainfapi-n6 state UP group default
8089: vethfd37653@if8088: <BROADCAST,MULTICAST,UP,LOWER_UP> mtu 1500 qdisc noqueue master br-oainfapi-n6 state UP group default
8099: oaitun_ue1: <POINTOPOINT,MULTICAST,NOARP> mtu 1500 qdisc noop state DOWN group default qlen 500
```

**Comment by PapaySail** [comment]
standart OAI spgwu (without eUPF) successfull connect packet capture:
sudo tcpdump -ni l2sim-public -w /tmp/l2sim-public-spgwu.pcap
[l2sim-public-spgwu.zip](https://github.com/edgecomllc/eupf/files/13479095/l2sim-public-spgwu.zip)

**Comment by PapaySail** [comment]
Image versions **develop** of gnb & ue
```ruby
sergo@edgecom:~/gitlab/openairinterface5g/ci-scripts/yaml_files/5g_l2sim_tdd$ sudo docker-compose ps -a
NAME                IMAGE                                   COMMAND                  SERVICE             CREATED             STATUS                        PORTS
eupf                ghcr.io/edgecomllc/eupf:main            "sh /app/bin/entrypo_"   edgecom-upf         16 hours ago        Up 16 hours                   0.0.0.0:9090->9090/tcp, :::9090->9090/tcp, 0.0.0.0:8880->8080/tcp, :::8880->8080/tcp
l2sim-mysql         mysql:8.0                               "docker-entrypoint.s_"   mysql               16 hours ago        Up 16 hours (healthy)         3306/tcp, 33060/tcp
l2sim-oai-amf       oaisoftwarealliance/oai-amf:v1.5.1      "python3 /openair-am_"   oai-amf             16 hours ago        Up 16 hours (healthy)         80/tcp, 9090/tcp, 38412/sctp
l2sim-oai-gnb       oaisoftwarealliance/oai-gnb:develop     "/opt/oai-gnb/bin/en_"   oai-gnb             42 minutes ago      Up 42 minutes (healthy)
l2sim-oai-nr-ue0    oaisoftwarealliance/oai-nr-ue:develop   "/opt/oai-nr-ue/bin/_"   oai-nr-ue0          42 minutes ago      Exited (139) 30 minutes ago
l2sim-oai-nrf       oaisoftwarealliance/oai-nrf:v1.5.1      "python3 /openair-nr_"   oai-nrf             16 hours ago        Up 16 hours (healthy)         80/tcp, 9090/tcp
l2sim-oai-smf       oaisoftwarealliance/oai-smf:v1.5.1      "python3 /openair-sm_"   oai-smf             16 hours ago        Up 16 hours (healthy)         80/tcp, 8080/tcp, 8805/udp
l2sim-proxy         oai-lte-multi-ue-proxy:latest           "/oai-lte-multi-ue-p_"   proxy               42 minutes ago      Up 42 minutes (healthy)
nat                 5g_l2sim_tdd-edgecom-nat                "sh /app/bin/busy-po_"   edgecom-nat         16 hours ago        Up 16 hours
```

```ruby
sudo tcpdump -ni l2sim-public -w /tmp/l2sim-public-eupfmain-gnbdev.pcap  "(host 192.168.72.135 and icmp) or (not host 192.168.72.135 and not arp and not port 53 and not port 2152 and not port 2153)"
```

172	0.030824	AMF	ens3NodeIf	NGAP/NAS-5GS	126	SACK (Ack=7, Arwnd=106496) , DownlinkNASTransport, DL NAS transport, **PDU session establishment reject (Requested service option not subscribed)**

<details><summary>pcap decode</summary>
<p>

```ruby
    141 0.204991       ens3NodeIf            AMF                   NGAP/NAS-5GS 138    UplinkNASTransport, UL NAS transport, PDU session establishment request

Frame 141: 138 bytes on wire (1104 bits), 138 bytes captured (1104 bits)
Ethernet II, Src: 02:42:f5:63:4e:73 (02:42:f5:63:4e:73), Dst: 02:42:c0:a8:47:84 (02:42:c0:a8:47:84)
Internet Protocol Version 4, Src: ens3NodeIf (188.120.232.247), Dst: AMF (192.168.71.132)
Stream Control Transmission Protocol, Src Port: 50342 (50342), Dst Port: 38412 (38412)
NG Application Protocol (UplinkNASTransport)
    0... .... Extension Bit: False
    Choice Index: 0
    NGAP-PDU: initiatingMessage (0)
        initiatingMessage
            procedureCode: id-UplinkNASTransport (46)
            Enumerated Index: 1
            criticality: ignore (1)
            Open Type Length: 71
            value
                UplinkNASTransport
                    0... .... Extension Bit: False
                    Sequence-Of Length: 4
                    protocolIEs: 4 items
                        Item 0: id-AMF-UE-NGAP-ID
                            ProtocolIE-Field
                                id: id-AMF-UE-NGAP-ID (10)
                                Enumerated Index: 0
                                criticality: reject (0)
                                Open Type Length: 2
                                value
                                    AMF-UE-NGAP-ID: 1
                        Item 1: id-RAN-UE-NGAP-ID
                            ProtocolIE-Field
                                id: id-RAN-UE-NGAP-ID (85)
                                Enumerated Index: 0
                                criticality: reject (0)
                                Open Type Length: 2
                                value
                                    RAN-UE-NGAP-ID: 1
                        Item 2: id-NAS-PDU
                            ProtocolIE-Field
                                id: id-NAS-PDU (38)
                                Enumerated Index: 0
                                criticality: reject (0)
                                Open Type Length: 33
                                value
                                    Octet String Length: 32
                                    NAS-PDU: 7e0479ac5576007e00670100072e0a01c1ffff91120a812201012504036f6169
                                        Non-Access-Stratum 5GS (NAS)PDU
                                            Security protected NAS 5GS message
                                            Plain NAS 5GS Message
                                                Extended protocol discriminator: 5G mobility management messages (126)
                                                0000 .... = Spare Half Octet: 0
                                                .... 0000 = Security header type: Plain NAS message, not security protected (0)
                                                Message type: UL NAS transport (0x67)
                                                0000 .... = Spare Half Octet: 0
                                                Payload container type
                                                    .... 0001 = Payload container type: N1 SM information (1)
                                                Payload container
                                                    Length: 7
                                                    Plain NAS 5GS Message
                                                        Extended protocol discriminator: 5G session management messages (46)
                                                        PDU session identity: PDU session identity value 10 (10)
                                                        Procedure transaction identity: 1
                                                        Message type: PDU session establishment request (0xc1)
                                                        Integrity protection maximum data rate
                                                        PDU session type
                                                            1001 .... = Element ID: 0x9-
                                                            .... .001 = PDU session type: IPv4 (1)
                                                PDU session identity 2 - PDU session ID
                                                Request type
                                                S-NSSAI
                                                    Element ID: 0x22
                                                    Length: 1
                                                    Slice/service type (SST): eMBB (1)
                                                DNN
                                                    Element ID: 0x25
                                                    Length: 4
                                                    DNN: oai
                        Item 3: id-UserLocationInformation
                            ProtocolIE-Field
                                id: id-UserLocationInformation (121)
                                Enumerated Index: 1
                                criticality: ignore (1)
                                Open Type Length: 15
                                value
                                    Choice Index: 1
                                    UserLocationInformation: userLocationInformationNR (1)
                                        userLocationInformationNR
                                            ..0. .... Extension Bit: False
                                            ...0 .... Optional Field Bit: False (timeStamp is NOT present)
                                            .... 0... Optional Field Bit: False (iE-Extensions is NOT present)
                                            nR-CGI
                                                .... .0.. Extension Bit: False
                                                .... ..0. Optional Field Bit: False (iE-Extensions is NOT present)
                                                pLMNIdentity: 02f899
                                                    Mobile Country Code (MCC): France (208)
                                                    Mobile Network Code (MNC): Unknown (99)
                                                nRCellIdentity: 0x00000e0000
                                            tAI
                                                .... 0... Extension Bit: False
                                                .... .0.. Optional Field Bit: False (iE-Extensions is NOT present)
                                                pLMNIdentity: 02f899
                                                    Mobile Country Code (MCC): France (208)
                                                    Mobile Network Code (MNC): Unknown (99)
                                                tAC: 1 (0x000001)

    172 0.030824       AMF                   ens3NodeIf            NGAP/NAS-5GS 126    SACK (Ack=7, Arwnd=106496) , DownlinkNASTransport, DL NAS transport, PDU session establishment reject (Requested service option not subscribed)

Frame 172: 126 bytes on wire (1008 bits), 126 bytes captured (1008 bits)
Ethernet II, Src: 02:42:c0:a8:47:84 (02:42:c0:a8:47:84), Dst: 02:42:f5:63:4e:73 (02:42:f5:63:4e:73)
Internet Protocol Version 4, Src: AMF (192.168.71.132), Dst: ens3NodeIf (188.120.232.247)
Stream Control Transmission Protocol, Src Port: 38412 (38412), Dst Port: 50342 (50342)
NG Application Protocol (DownlinkNASTransport)
    0... .... Extension Bit: False
    Choice Index: 0
    NGAP-PDU: initiatingMessage (0)
        initiatingMessage
            procedureCode: id-DownlinkNASTransport (4)
            Enumerated Index: 1
            criticality: ignore (1)
            Open Type Length: 41
            value
                DownlinkNASTransport
                    0... .... Extension Bit: False
                    Sequence-Of Length: 3
                    protocolIEs: 3 items
                        Item 0: id-AMF-UE-NGAP-ID
                            ProtocolIE-Field
                                id: id-AMF-UE-NGAP-ID (10)
                                Enumerated Index: 0
                                criticality: reject (0)
                                Open Type Length: 2
                                value
                                    AMF-UE-NGAP-ID: 1
                        Item 1: id-RAN-UE-NGAP-ID
                            ProtocolIE-Field
                                id: id-RAN-UE-NGAP-ID (85)
                                Enumerated Index: 0
                                criticality: reject (0)
                                Open Type Length: 2
                                value
                                    RAN-UE-NGAP-ID: 1
                        Item 2: id-NAS-PDU
                            ProtocolIE-Field
                                id: id-NAS-PDU (38)
                                Enumerated Index: 0
                                criticality: reject (0)
                                Open Type Length: 22
                                value
                                    Octet String Length: 21
                                    NAS-PDU: 7e020d1b0c38027e00680100062e0a01c321f1120a
                                        Non-Access-Stratum 5GS (NAS)PDU
                                            Security protected NAS 5GS message
                                            Plain NAS 5GS Message
                                                Extended protocol discriminator: 5G mobility management messages (126)
                                                0000 .... = Spare Half Octet: 0
                                                .... 0000 = Security header type: Plain NAS message, not security protected (0)
                                                Message type: DL NAS transport (0x68)
                                                0000 .... = Spare Half Octet: 0
                                                Payload container type
                                                    .... 0001 = Payload container type: N1 SM information (1)
                                                Payload container
                                                    Length: 6
                                                    Plain NAS 5GS Message
                                                        Extended protocol discriminator: 5G session management messages (46)
                                                        PDU session identity: PDU session identity value 10 (10)
                                                        Procedure transaction identity: 1
                                                        Message type: PDU session establishment reject (0xc3)
                                                        5GSM cause - ESM cause
                                                            5GSM cause: Requested service option not subscribed (33)
                                                        Allowed SSC mode
                                                            1111 .... = Element ID: 0xf-
                                                            .... 0... = Spare: 0
                                                            .... .0.. = SSC mode 3: Not Allowed
                                                            .... ..0. = SSC mode 2: Not Allowed
                                                            .... ...1 = SSC mode 1: Allowed
                                                PDU session identity 2 - PDU session ID
``` 

</p>
</details> 

[l2sim-public-eupfmain-gnbdev.zip](https://github.com/edgecomllc/eupf/files/13499476/l2sim-public-eupfmain-gnbdev.zip)

**Comment by PapaySail** [comment]
Investigation: 5G PDU Session and Its Types   https://www.techplayon.com/ssc-modes-session-and-service-continuity-in-5g/
> PDU Sessions with PDU Session types IPv4, IPv6 and IPv4v6 can have any of the SSC modes 1, 2 or 3. 
SSC Mode (Service and Session Continuity mode): SSC mode refer to the longevity of the User Plane anchor point of the PDU Session, whether it can be re-allocated or not

> - UE can request a specific  mode using the ‘SSC Mode‘ field within the NAS: PDU Session Establishment Request
> - The SMF specifics the allocated mode using the ‘Selected SSC Mode‘ field within the NAS: PDU Session Eslablishment Accept

> The 3GPP release 15 only supports Mode 3 for IP based PDU Sessions.
SSC Mode 3: ... For example, the IP address allocated to the UE will be updated if the Anchor UPF changes but the change procedure will ensure that connectivity is preserved, i.e. connectivity towards the new Anchor UPF is established before releasing the connection to the old Anchor UPF. The 3GPP release 15 only supports Mode 3 for IP based PDU Sessions.

**Comment by PapaySail** [comment]
Found the sorce of problem:: [smf] [smf_app] [warn ] No UPF available

<details><summary>SMF log</summary>
<p>

sudo docker-compose logs oai-smf |less
```ruby
l2sim-oai-smf  | [2023-12-02T16:17:51.815050] [smf] [smf_app] [debug] UE Address Allocation
l2sim-oai-smf  | [2023-12-02T16:17:51.815053] [smf] [smf_app] [info ] Find a DNN Subscription with key: 4294967041 (SST 1, SD 16777215 (0xffffff)), map size 1
l2sim-oai-smf  | [2023-12-02T16:17:51.815055] [smf] [smf_app] [info ] Find DNN configuration with DNN oai
l2sim-oai-smf  | [2023-12-02T16:17:51.815058] [smf] [smf_app] [debug] PDU Session Type IPv4
l2sim-oai-smf  | [2023-12-02T16:17:51.815063] [smf] [smf_app] [info ] PAA, Ipv4 Address: 12.1.1.2
l2sim-oai-smf  | [2023-12-02T16:17:51.815078] [smf] [sbi_srv] [debug] AMF IP Addr 192.168.71.132:80
l2sim-oai-smf  | [2023-12-02T16:17:51.815080] [smf] [smf_app] [debug] Send ITTI msg to SMF APP to trigger the response of Server
l2sim-oai-smf  | [2023-12-02T16:17:51.815087] [smf] [smf_app] [debug] Trigger PDU Session Create SM Context Response: Set promise with ID 47 to ready
l2sim-oai-smf  | [2023-12-02T16:17:51.815108] [smf] [smf_app] [debug] Trigger the response from SMF: Set promise with ID 47 to ready
l2sim-oai-smf  | [2023-12-02T16:17:51.815124] [smf] [smf_app] [info ] Create a procedure to process this message.
l2sim-oai-smf  | [2023-12-02T16:17:51.815130] [smf] [smf_app] [info ] Perform a procedure - Create SM Context Request
l2sim-oai-smf  | [2023-12-02T16:17:51.815132] [smf] [smf_app] [info ] Find PDU Session with ID 10
l2sim-oai-smf  | [2023-12-02T16:17:51.815135] [smf] [smf_app] [info ] Select UPF Node
l2sim-oai-smf  | [2023-12-02T16:17:51.815138] [smf] [smf_app] [warn ] No UPF available
l2sim-oai-smf  | [2023-12-02T16:17:51.815142] [smf] [smf_app] [warn ] UPF could not be selected for the PDU session
l2sim-oai-smf  | [2023-12-02T16:17:51.815144] [smf] [smf_app] [info ] PDU Session Establishment Request: Create SM Context Request procedure failed
l2sim-oai-smf  | [2023-12-02T16:17:51.815149] [smf] [smf_app] [debug] Create PDU Session Establishment Reject
l2sim-oai-smf  | [2023-12-02T16:17:51.815151] [smf] [smf_n1 ] [info ] Create N1 SM Container, PDU Session Establishment Reject
l2sim-oai-smf  | [2023-12-02T16:17:51.815152] [smf] [smf_n1 ] [info ] PDU_SESSION_ESTABLISHMENT_REJECT, encode starting...
```

</p>
</details>

**Comment by PapaySail** [comment]
Fresh working image is:
ghcr.io/edgecomllc/eupf:7086b71cb1dbc254db84c30e14fa4a68d3beb132
with -

<details><summary>But there is no responce in GTP</summary>
<p>

```ruby
sergo@edgecom:~/gitlab/openairinterface5g/ci-scripts/yaml_files/5g_l2sim_tdd$ sudo docker-compose down oai-nr-ue0 proxy oai-gnb
[+] Running 7/7
 _ Container l2sim-oai-nr-ue0       Removed                                                                                                                       0.1s
 _ Container l2sim-proxy            Removed                                                                                                                      10.2s
 _ Container l2sim-oai-gnb          Removed                                                                                                                       0.2s
 ! Network 5g_l2sim_tdd_privnet_n6  Resource is still in use                                                                                                      0.0s
 _ Network 5g_l2sim_tdd_default     Removed                                                                                                                       0.3s
 ! Network l2sim-oai-public-net     Resource is still in use                                                                                                      0.0s
 ! Network l2sim-oai-traffic-net    Resource is still in use                                                                                                      0.0s
sergo@edgecom:~/gitlab/openairinterface5g/ci-scripts/yaml_files/5g_l2sim_tdd$
sergo@edgecom:~/gitlab/openairinterface5g/ci-scripts/yaml_files/5g_l2sim_tdd$
sergo@edgecom:~/gitlab/openairinterface5g/ci-scripts/yaml_files/5g_l2sim_tdd$ sudo docker-compose up -d  oai-gnb
[+] Running 2/2
 _ Network 5g_l2sim_tdd_default  Created                                                                                                                          0.1s
 _ Container l2sim-oai-gnb       Started                                                                                                                          0.2s
sergo@edgecom:~/gitlab/openairinterface5g/ci-scripts/yaml_files/5g_l2sim_tdd$ sudo docker-compose up -d proxy oai-nr-ue0
[+] Running 3/3
 _ Container l2sim-oai-gnb     Running                                                                                                                            0.0s
 _ Container l2sim-proxy       Started                                                                                                                            0.2s
 _ Container l2sim-oai-nr-ue0  Started                                                                                                                            0.3s
sergo@edgecom:~/gitlab/openairinterface5g/ci-scripts/yaml_files/5g_l2sim_tdd$ ping -I oaitun_ue1 -c 3 1.1.1.1
PING 1.1.1.1 (1.1.1.1) from 12.1.1.2 oaitun_ue1: 56(84) bytes of data.

--- 1.1.1.1 ping statistics ---
3 packets transmitted, 0 received, 100% packet loss, time 2042ms


ip a |grep oai
8790: oaitun_ue1: <POINTOPOINT,MULTICAST,NOARP,UP,LOWER_UP> mtu 1500 qdisc fq_codel state UNKNOWN group default qlen 500
    inet 12.1.1.2/24 brd 12.1.1.255 scope global oaitun_ue1
```

OK req-repl over edgecom-nat:
```ruby
sudo tcpdump -ni br-oainfapi-n6
17:29:06.706598 ARP, Request who-has 10.100.250.3 tell 10.100.250.2, length 28
17:29:06.706647 ARP, Reply 10.100.250.3 is-at 02:42:0a:64:fa:03, length 28
17:29:06.706655 IP 12.1.1.2 > 1.1.1.1: ICMP echo request, id 54, seq 1, length 64
17:29:06.706738 ARP, Request who-has 10.100.250.1 tell 10.100.250.3, length 28
17:29:06.706750 ARP, Reply 10.100.250.1 is-at 02:42:0d:18:d5:fa, length 28
17:29:06.706756 IP 10.100.250.3 > 1.1.1.1: ICMP echo request, id 54, seq 1, length 64
17:29:06.712085 IP 1.1.1.1 > 10.100.250.3: ICMP echo reply, id 54, seq 1, length 64
17:29:06.712185 IP 1.1.1.1 > 12.1.1.2: ICMP echo reply, id 54, seq 1, length 64
17:29:07.599033 IP 12.1.1.2 > 1.1.1.1: ICMP echo request, id 54, seq 2, length 64
17:29:07.599117 IP 10.100.250.3 > 1.1.1.1: ICMP echo request, id 54, seq 2, length 64
17:29:07.604487 IP 1.1.1.1 > 10.100.250.3: ICMP echo reply, id 54, seq 2, length 64
17:29:07.604588 IP 1.1.1.1 > 12.1.1.2: ICMP echo reply, id 54, seq 2, length 64
17:29:08.669458 IP 12.1.1.2 > 1.1.1.1: ICMP echo request, id 54, seq 3, length 64
17:29:08.669526 IP 10.100.250.3 > 1.1.1.1: ICMP echo request, id 54, seq 3, length 64
17:29:08.674812 IP 1.1.1.1 > 10.100.250.3: ICMP echo reply, id 54, seq 3, length 64
17:29:08.674829 IP 1.1.1.1 > 12.1.1.2: ICMP echo reply, id 54, seq 3, length 64
17:29:11.735379 ARP, Request who-has 10.100.250.3 tell 10.100.250.1, length 28
17:29:11.735490 ARP, Reply 10.100.250.3 is-at 02:42:0a:64:fa:03, length 28
```

But there is no responce in GTP, see attached file
```ruby
sergo@edgecom:~/edgecom/free5gc-compose$ sudo tcpdump -ni l2sim-public -w /tmp/l2sim-public-uplinkonly.pcap
tcpdump: listening on l2sim-public, link-type EN10MB (Ethernet), snapshot length 262144 bytes
^C223 packets captured
223 packets received by filter
0 packets dropped by kernel
```
filtered GTP packets:
```ruby
No.     Time               Source                Destination           Protocol Length Info
    162 17:28:54.612506    fe80::3f39:5b53:8897:5b65 ff02::2               GTP <ICMPv6> 106    Router Solicitation
    171 17:28:58.686140    fe80::3f39:5b53:8897:5b65 ff02::2               GTP <ICMPv6> 106    Router Solicitation
    190 17:29:06.706518    12.1.1.2              one.one.one.one       GTP <ICMP> 142    Echo (ping) request  id=0x0036, seq=1/256, ttl=64 (no response found!)
    193 17:29:07.578507    fe80::3f39:5b53:8897:5b65 ff02::2               GTP <ICMPv6> 106    Router Solicitation
    194 17:29:07.598997    12.1.1.2              one.one.one.one       GTP <ICMP> 142    Echo (ping) request  id=0x0036, seq=2/512, ttl=64 (no response found!)
    195 17:29:08.669423    12.1.1.2              one.one.one.one       GTP <ICMP> 142    Echo (ping) request  id=0x0036, seq=3/768, ttl=64 (no response found!)
```

eUPF log:
```ruby
eupf  | 2023/12/07 14:28:53 DBG Received 164 bytes from 192.168.71.133:8805
eupf  | 2023/12/07 14:28:53 DBG Handling PFCP message from 192.168.71.133:8805
eupf  | 2023/12/07 14:28:53 INF Got Session Establishment Request from: 192.168.71.133.
eupf  | 2023/12/07 14:28:53 INF
eupf  | Session Establishment Request:
eupf  |   CreatePDR ID: 1
eupf  |     Outer Header Removal: 0
eupf  |     FAR ID: 1
eupf  |     Source Interface: 0
eupf  |     TEID: 0
eupf  |     Ipv4: <nil>
eupf  |     Ipv6: <nil>
eupf  |     UE IPv4 Address: 12.1.1.2
eupf  |   CreateFAR ID: 1
eupf  |     Apply Action: [2]
eupf  |     Forwarding Parameters:
eupf  |       Network Instance: coreoaiorg
eupf  |
eupf  |
eupf  | 2023/12/07 14:28:53 INF WARN: No OuterHeaderCreation
eupf  | 2023/12/07 14:28:53 INF Saving FAR info to session: 1, {Action:2 OuterHeaderCreation:0 Teid:0 RemoteIP:0 LocalIP:2252843200 TransportLevelMarking:0}
eupf  | 2023/12/07 14:28:53 DBG EBPF: Put FAR: internalId=1, qerInfo={Action:2 OuterHeaderCreation:0 Teid:0 RemoteIP:0 LocalIP:2252843200 TransportLevelMarking:0}
eupf  | 2023/12/07 14:28:53 DBG EBPF: Put PDR Uplink: teid=2, pdrInfo={OuterHeaderRemoval:0 FarId:1 QerId:0 SdfFilter:<nil>}
eupf  | 2023/12/07 14:28:53 INF Session Establishment Request from 192.168.71.133 accepted.
eupf  | 2023/12/07 14:28:54 DBG Received 136 bytes from 192.168.71.133:8805
eupf  | 2023/12/07 14:28:54 DBG Handling PFCP message from 192.168.71.133:8805
eupf  | 2023/12/07 14:28:54 INF Got Session Modification Request from: 192.168.71.133.
eupf  |
eupf  |
eupf  | 2023/12/07 14:28:54 INF Finding association for 192.168.71.133
eupf  | 2023/12/07 14:28:54 INF Finding session 3
eupf  | 2023/12/07 14:28:54 INF
eupf  | Session Modification Request:
eupf  |   CreatePDR ID: 2
eupf  |     FAR ID: 2
eupf  |     Source Interface: 1
eupf  |     UE IPv4 Address: 12.1.1.2
eupf  |   CreateFAR ID: 2
eupf  |     Apply Action: [2]
eupf  |     Forwarding Parameters:
eupf  |       Network Instance: accessoaiorg
eupf  |       Outer Header Creation: &{OuterHeaderCreationDescription:256 TEID:2178314469 IPv4Address:192.168.71.129 IPv6Address:<nil> PortNumber:0 CTag:0 STag:0}
eupf  |
eupf  |
eupf  | 2023/12/07 14:28:54 INF Saving FAR info to session: 2, {Action:2 OuterHeaderCreation:1 Teid:2178314469 RemoteIP:2168957120 LocalIP:2252843200 TransportLevelMarking:0}
eupf  | 2023/12/07 14:28:54 DBG EBPF: Put FAR: internalId=2, qerInfo={Action:2 OuterHeaderCreation:1 Teid:2178314469 RemoteIP:2168957120 LocalIP:2252843200 TransportLevelMarking:0}
eupf  | 2023/12/07 14:28:54 DBG EBPF: Put PDR Downlink: ipv4=12.1.1.2, pdrInfo={OuterHeaderRemoval:0 FarId:2 QerId:0 SdfFilter:<nil>}
eupf  | 2023/12/07 14:28:54 DBG Sent Heartbeat Request to: 192.168.71.133
eupf  | 2023/12/07 14:28:54 DBG Received 16 bytes from 192.168.71.133:8805
eupf  | 2023/12/07 14:28:54 DBG Handling PFCP message from 192.168.71.133:8805
eupf  | 2023/12/07 14:28:54 DBG Got Heartbeat Response with TS: 2023-12-07 14:15:42 +0000 UTC, from: 192.168.71.133

```

</p>
</details> 
@pirog-spb check what is wrong, please.
[l2sim-public-uplinkonly.zip](https://github.com/edgecomllc/eupf/files/13601530/l2sim-public-uplinkonly.zip)

**Comment by PapaySail** [comment]
✔ Ok. fixed `ip route` at nat container.
## Verify 0-scenario 
```ruby
sergo@edgecom:~/gitlab/openairinterface5g/ci-scripts/yaml_files/5g_l2sim_tdd$ sudo docker-compose restart oai-gnb
[+] Restarting 1/1
 _ Container l2sim-oai-gnb  Started                                                                                                                                                0.3s
sergo@edgecom:~/gitlab/openairinterface5g/ci-scripts/yaml_files/5g_l2sim_tdd$ sudo docker-compose up -d proxy oai-nr-ue0
[+] Running 4/4
 _ Network 5g_l2sim_tdd_default  Created                                                                                                                                           0.1s
 _ Container l2sim-oai-gnb       Running                                                                                                                                           0.0s
 _ Container l2sim-proxy         Started                                                                                                                                           0.2s
 _ Container l2sim-oai-nr-ue0    Started                                                                                                                                           0.3s
sergo@edgecom:~/gitlab/openairinterface5g/ci-scripts/yaml_files/5g_l2sim_tdd$ ip a |grep oaitun
8808: oaitun_ue1: <POINTOPOINT,MULTICAST,NOARP,UP,LOWER_UP> mtu 1500 qdisc fq_codel state UNKNOWN group default qlen 500
    inet 12.1.1.5/24 brd 12.1.1.255 scope global oaitun_ue1
sergo@edgecom:~/gitlab/openairinterface5g/ci-scripts/yaml_files/5g_l2sim_tdd$ ping -I oaitun_ue1 -c 3 1.1.1.1
PING 1.1.1.1 (1.1.1.1) from 12.1.1.5 oaitun_ue1: 56(84) bytes of data.
64 bytes from 1.1.1.1: icmp_seq=1 ttl=54 time=213 ms
64 bytes from 1.1.1.1: icmp_seq=2 ttl=54 time=92.5 ms
64 bytes from 1.1.1.1: icmp_seq=3 ttl=54 time=178 ms

--- 1.1.1.1 ping statistics ---
3 packets transmitted, 3 received, 0% packet loss, time 2003ms
rtt min/avg/max/mdev = 92.489/161.273/213.485/50.767 ms

sergo@edgecom:~/gitlab/openairinterface5g/ci-scripts/yaml_files/5g_l2sim_tdd$ sudo docker-compose ps -a
NAME                IMAGE                                                              COMMAND                  SERVICE             CREATED             STATUS                    PORTS
eupf                ghcr.io/edgecomllc/eupf:7086b71cb1dbc254db84c30e14fa4a68d3beb132   "sh /app/bin/entrypo_"   edgecom-upf         18 hours ago        Up 18 hours               0.0.0.0:9090->9090/tcp, :::9090->9090/tcp, 0.0.0.0:8880->8080/tcp, :::8880->8080/tcp
l2sim-mysql         mysql:8.0                                                          "docker-entrypoint.s_"   mysql               40 hours ago        Up 40 hours (healthy)     3306/tcp, 33060/tcp
l2sim-oai-amf       oaisoftwarealliance/oai-amf:v1.5.0                                 "python3 /openair-am_"   oai-amf             40 hours ago        Up 40 hours (healthy)     80/tcp, 9090/tcp, 38412/sctp
l2sim-oai-ext-dn    oaisoftwarealliance/trf-gen-cn5g:focal                             "/bin/bash -c ' ipta_"   oai-ext-dn          40 hours ago        Up 40 hours (unhealthy)
l2sim-oai-gnb       oaisoftwarealliance/oai-gnb:develop                                "/opt/oai-gnb/bin/en_"   oai-gnb             59 minutes ago      Up 2 minutes (healthy)
l2sim-oai-nr-ue0    oaisoftwarealliance/oai-nr-ue:develop                              "/opt/oai-nr-ue/bin/_"   oai-nr-ue0          2 minutes ago       Up 2 minutes (healthy)
l2sim-oai-nrf       oaisoftwarealliance/oai-nrf:v1.5.0                                 "python3 /openair-nr_"   oai-nrf             40 hours ago        Up 40 hours (healthy)     80/tcp, 9090/tcp
l2sim-oai-smf       oaisoftwarealliance/oai-smf:v1.5.1                                 "python3 /openair-sm_"   oai-smf             40 hours ago        Up 18 hours (healthy)     80/tcp, 8080/tcp, 8805/udp
l2sim-oai-spgwu     oaisoftwarealliance/oai-spgwu-tiny:v1.5.0                          "python3 /openair-sp_"   oai-spgwu           40 hours ago        Exited (0) 40 hours ago
l2sim-proxy         oai-lte-multi-ue-proxy:latest                                      "/oai-lte-multi-ue-p_"   proxy               2 minutes ago       Up 2 minutes (healthy)
nat                 5g_l2sim_tdd-edgecom-nat                                           "sh /app/bin/busy-po_"   edgecom-nat         39 hours ago        Up 39 hours
```
See #490

📝 A few minutes after starting oai-nr-ue0 we feel the terminal response slow down and the system sluggish and the longer the more.


## How to deploy:
1. Deploy  the whole project OAI Full Stack 5G-NR L2 simulation with containers and a proxy. As described in https://github.com/edgecomllc/eupf/issues/340#issuecomment-1786589650
    (following instructions https://gitlab.eurecom.fr/oai/openairinterface5g/-/blob/develop/ci-scripts/yaml_files/5g_l2sim_tdd/README.md)
    Don't start it.
2. Copy content of folder `edgecomllc/eupf/docs/deployments/oai-nfapi-sim-compose` from https://github.com/edgecomllc/eupf repository to your `openairinterface5g/ci-scripts/yaml_files/5g_l2sim_tdd`
3. Start containers in the following order:
    ```ruby
    sudo docker-compose up -d mysql oai-nrf oai-amf oai-smf edgecom-nat edgecom-upf
    sudo docker-compose up -d  oai-gnb
    sudo docker-compose up -d proxy oai-nr-ue0
    ```
4. Check interface `oaitun_ue1` created and ip address set: `ip a |grep oaitun`
    ```ruby
    ip a |grep oaitun
    8808: oaitun_ue1: <POINTOPOINT,MULTICAST,NOARP,UP,LOWER_UP> mtu 1500 qdisc fq_codel state UNKNOWN group default qlen 500
        inet 12.1.1.5/24 brd 12.1.1.255 scope global oaitun_ue1
    ```
5. Check the Internet is accessible over created GTP tunnel
    ```ruby
    ping -I oaitun_ue1 -c 3 1.1.1.1
    PING 1.1.1.1 (1.1.1.1) from 12.1.1.5 oaitun_ue1: 56(84) bytes of data.
    64 bytes from 1.1.1.1: icmp_seq=1 ttl=54 time=192 ms
    64 bytes from 1.1.1.1: icmp_seq=2 ttl=54 time=68.0 ms
    64 bytes from 1.1.1.1: icmp_seq=3 ttl=54 time=150 ms
    
    --- 1.1.1.1 ping statistics ---
    3 packets transmitted, 3 received, 0% packet loss, time 2000ms
    rtt min/avg/max/mdev = 67.998/136.369/191.533/51.290 ms
    ```
6. `sudo docker-compose down oai-nr-ue0 proxy` to free up resources before the system sluggish.

**Comment by tariromukute** [comment]
Hi @pirog-spb and @PapaySail. FYI - I tried integrating OAI with eUPF. I faced an issue where PDR and FAR rules where being installed but the PDU session was not completing. I used, UERANSIM, OAI and eUPF. Turned out the issue was with OAI SMF function, I resolved the issue, you can check the [Merge Request](https://gitlab.eurecom.fr/oai/cn5g/oai-cn5g-smf/-/merge_requests/247) for more details. The integration now works with the OAI develop branch.
