### ISSUE TITLE
Response packets from eUPF are not processed at srsUE

### ISSUE THREAD

**Issue by pirog-spb** [edgecomllc/eupf#428]
```
    Image:         ghcr.io/edgecomllc/eupf:main
    Image ID:      ghcr.io/edgecomllc/eupf@sha256:085ac2a0dc335e75c5fbe0366d07cacfa5f0f93d6a9d99260a8bdff8d53c01a9
```
srsUE Built in Release mode using commit fa56836b1 on branch HEAD.
<details><summary>srsUE launch log</summary>
<p>

```ruby
Launching srsue
+ /bin/srsue /ue.conf --log.filename /dev/stdout --log.all_level warning --ue.phy nr --rat.eutra.dl_earfcn 2850 --rat.eutra.nof_carri
ers 0 --rat.nr.bands 3 --rat.nr.nof_carriers 1 --rrc.ue_category 4 --rrc.release 15 --nas.apn internet
Active RF plugins: libsrsran_rf_uhd.so libsrsran_rf_zmq.so
Inactive RF plugins:
Reading configuration file /ue.conf...

Built in Release mode using commit fa56836b1 on branch HEAD.

Opening 1 channels in RF device=zmq with args=tx_port=tcp://127.0.0.1:2001,rx_port=tcp://127.0.0.1:2000,id=ue,base_srate=11.52e6
Supported RF device list: UHD zmq file
CHx base_srate=11.52e6
CHx id=ue
Current sample rate is 1.92 MHz with a base rate of 11.52 MHz (x6 decimation)
CH0 rx_port=tcp://127.0.0.1:2000
CH0 tx_port=tcp://127.0.0.1:2001
Current sample rate is 11.52 MHz with a base rate of 11.52 MHz (x1 decimation)
Current sample rate is 11.52 MHz with a base rate of 11.52 MHz (x1 decimation)
Waiting PHY to initialize ... done!
Attaching UE...
Closing stdin thread.
Random Access Transmission: prach_occasion=0, preamble_index=0, ra-rnti=0x39, tti=654
Random Access Complete.     c-rnti=0x4601, ta=0
RRC Connected
PDU Session Establishment successful. IP: 10.46.0.9
RRC NR reconfiguration successful.
``` 

</p>
</details> 

❌ Responce packets are not processed at srsUE. 🐛 @pirog-spb 
`kubectl sniff -n open5gslice srsran-srs-lte-0 -f "not host 127.0.0.1"`

<details><summary>Details</summary>
<p>

```ruby
root@srsran-srs-lte-0:/# ping -I tun_srsue 10.233.64.1  -c 5
PING 10.233.64.1 (10.233.64.1) from 10.46.0.9 tun_srsue: 56(84) bytes of data.

--- 10.233.64.1 ping statistics ---
5 packets transmitted, 0 received, 100% packet loss, time 4095ms

root@srsran-srs-lte-0:/# ping -I tun_srsue 1.1.1.1 -c2
PING 1.1.1.1 (1.1.1.1) from 10.46.0.9 tun_srsue: 56(84) bytes of data.

--- 1.1.1.1 ping statistics ---
2 packets transmitted, 0 received, 100% packet loss, time 1028ms

/ # iperf3 -c 10.233.64.1 -p 5201 -t 30 -R  --bind-dev tun_srsue
^C- - - - - - - - - - - - - - - - - - - - - - - - -
[ ID] Interval           Transfer     Bitrate
iperf3: interrupt - the client has terminated
/ #
``` 
Example packets dump
```ruby
No.     Time           Source                Destination           Protocol Length Info
    207 5.762811       10.46.0.9             10.233.64.1           TCP      76     52380 → 5201 [SYN] Seq=0 Win=64240 Len=0 MSS=1460 SACK_PERM TSval=2148501962 TSecr=0 WS=128
    208 0.034427       10.46.0.9             10.233.64.1           GTP <TCP> 120    [TCP Retransmission] 52380 → 5201 [SYN] Seq=0 Win=64240 Len=0 MSS=1460 SACK_PERM TSval=2148501962 TSecr=0 WS=128
    209 0.000448       10.233.64.1           10.46.0.9             GTP <TCP> 112    5201 → 52380 [SYN, ACK] Seq=0 Ack=1 Win=65160 Len=0 MSS=1460 SACK_PERM TSval=1892768424 TSecr=2148501962 WS=128
    210 0.602288       10.233.22.229         10.233.64.57          SCTP     108    HEARTBEAT 
    211 0.000019       10.233.64.57          10.233.22.229         SCTP     108    HEARTBEAT_ACK 
    212 0.379907       10.46.0.9             10.233.64.1           TCP      76     [TCP Retransmission] 52380 → 5201 [SYN] Seq=0 Win=64240 Len=0 MSS=1460 SACK_PERM TSval=2148502979 TSecr=0 WS=128
    213 0.027753       10.46.0.9             10.233.64.1           GTP <TCP> 120    [TCP Retransmission] 52380 → 5201 [SYN] Seq=0 Win=64240 Len=0 MSS=1460 SACK_PERM TSval=2148502979 TSecr=0 WS=128
    214 0.000186       10.233.64.1           10.46.0.9             GTP <TCP> 112    [TCP Retransmission] 5201 → 52380 [SYN, ACK] Seq=0 Ack=1 Win=65160 Len=0 MSS=1460 SACK_PERM TSval=1892769434 TSecr=2148501962 WS=128
    215 1.028213       10.233.64.1           10.46.0.9             GTP <TCP> 112    [TCP Retransmission] 5201 → 52380 [SYN, ACK] Seq=0 Ack=1 Win=65160 Len=0 MSS=1460 SACK_PERM TSval=1892770462 TSecr=2148501962 WS=128
    216 0.959843       10.46.0.9             10.233.64.1           TCP      76     [TCP Retransmission] 52380 → 5201 [SYN] Seq=0 Win=64240 Len=0 MSS=1460 SACK_PERM TSval=2148504995 TSecr=0 WS=128
    217 0.041925       10.46.0.9             10.233.64.1           GTP <TCP> 120    [TCP Retransmission] 52380 → 5201 [SYN] Seq=0 Win=64240 Len=0 MSS=1460 SACK_PERM TSval=2148504995 TSecr=0 WS=128
    218 0.000190       10.233.64.1           10.46.0.9             GTP <TCP> 112    [TCP Retransmission] 5201 → 52380 [SYN, ACK] Seq=0 Ack=1 Win=65160 Len=0 MSS=1460 SACK_PERM TSval=1892771465 TSecr=2148501962 WS=128
    219 2.005978       10.233.64.1           10.46.0.9             GTP <TCP> 112    [TCP Retransmission] 5201 → 52380 [SYN, ACK] Seq=0 Ack=1 Win=65160 Len=0 MSS=1460 SACK_PERM TSval=1892773470 TSecr=2148501962 WS=128
``` 

</p>
</details> 

[srsUE-eUPFpcap.zip](https://github.com/edgecomllc/eupf/files/12728548/srsUE-eUPFpcap.zip)

**Comment by pirog-spb** [comment]
@PapaySail According to the packet dump gNB received SYN-ACK but didn't forward to UE. Let's check gNB logs for som info.

**Comment by PapaySail** [comment]
ℹ srsUE is ready to check
<details><summary>srsUE successfully connected to eUPF</summary>
<p>

srsUE Logs(open5gslice/srsran-srs-lte-0:ue):
```prolog
RRC Connected
PDU Session Establishment successful. IP: 10.46.0.3
RRC NR reconfiguration successful.
``` 

eUPF Logs(open5gslice/eupf2-745c994b58-xpbw5:eupf):
```prolog
2023/10/07 17:42:23 Handling PFCP message from 10.233.64.21:8805
2023/10/07 17:42:23 Got Heartbeat Response with TS: 2023-10-04 09:52:23 +0000 UTC, from: 10.233.64.21
2023/10/07 17:42:25 Received 647 bytes from 10.233.64.21:8805
2023/10/07 17:42:25 Handling PFCP message from 10.233.64.21:8805
2023/10/07 17:42:25 Got Session Establishment Request from: 10.233.64.21.
2023/10/07 17:42:25 
Session Establishment Request:
  CreatePDR ID: 1 
    FAR ID: 1 
    QER ID: 1 
    URR ID: 1 
    Source Interface: 1 
    UE IPv4 Address: 10.46.0.3 
  CreatePDR ID: 2 
    Outer Header Removal: 0 
    FAR ID: 2 
    QER ID: 1 
    Source Interface: 0 
    TEID: 6 
    Ipv4: 10.233.5.59 
    Ipv6: <nil> 
    UE IPv4 Address: 10.46.0.3 
  CreatePDR ID: 3 
    Outer Header Removal: 0 
    FAR ID: 1 
    QER ID: 1 
    Source Interface: 3 
    TEID: 7 
    Ipv4: 10.233.5.59 
    Ipv6: <nil> 
  CreatePDR ID: 4 
    Outer Header Removal: 0 
    FAR ID: 3 
    Source Interface: 0 
    TEID: 6 
    Ipv4: 10.233.5.59 
    Ipv6: <nil> 
    SDF Filter: permit out 58 from ff02::2/128 to assigned 
  CreateFAR ID: 1 
    Apply Action: [12 0] 
    BAR ID: 1 
  CreateFAR ID: 2 
    Apply Action: [2 0] 
    Forwarding Parameters:
      Network Instance: internet 
  CreateFAR ID: 3 
    Apply Action: [2 0] 
    Forwarding Parameters:
      Network Instance: internet 
      Outer Header Creation: &{OuterHeaderCreationDescription:256 TEID:2 IPv4Address:10.233.64.21 IPv6Address:<nil> PortNumber:0 CTag:0 STag:0} 
  CreateQER ID: 1 
    Gate Status DL: 0 
    Gate Status UL: 0 
    Max Bitrate DL: 999999 
    Max Bitrate UL: 999999 
    QFI: 1 
  CreateURR ID: 1 
    Measurement Method: 2 
    Volume Threshold: &{Flags:1 TotalVolume:104857600 UplinkVolume:0 DownlinkVolume:0} 
  CreateBAR ID: 1
2023/10/07 17:42:25 Saving FAR info to session: 1, {Action:12 OuterHeaderCreation:0 Teid:0 RemoteIP:0 LocalIP:507570442 TransportLevelMarking:0}
2023/10/07 17:42:25 EBPF: Put FAR: internalId=3, qerInfo={Action:12 OuterHeaderCreation:0 Teid:0 RemoteIP:0 LocalIP:507570442 TransportLevelMarking:0}
2023/10/07 17:42:25 WARN: No OuterHeaderCreation
2023/10/07 17:42:25 Saving FAR info to session: 2, {Action:2 OuterHeaderCreation:0 Teid:0 RemoteIP:0 LocalIP:507570442 TransportLevelMarking:0}
2023/10/07 17:42:25 EBPF: Put FAR: internalId=4, qerInfo={Action:2 OuterHeaderCreation:0 Teid:0 RemoteIP:0 LocalIP:507570442 TransportLevelMarking:0}
2023/10/07 17:42:25 Saving FAR info to session: 3, {Action:2 OuterHeaderCreation:1 Teid:2 RemoteIP:356575498 LocalIP:507570442 TransportLevelMarking:0}
2023/10/07 17:42:25 EBPF: Put FAR: internalId=5, qerInfo={Action:2 OuterHeaderCreation:1 Teid:2 RemoteIP:356575498 LocalIP:507570442 TransportLevelMarking:0}
2023/10/07 17:42:25 Saving QER info to session: 1, {GateStatusUL:0 GateStatusDL:0 Qfi:1 MaxBitrateUL:999999000 MaxBitrateDL:999999000 StartUL:0 StartDL:0}
2023/10/07 17:42:25 EBPF: Put QER: internalId=1, qerInfo={GateStatusUL:0 GateStatusDL:0 Qfi:1 MaxBitrateUL:999999000 MaxBitrateDL:999999000 StartUL:0 StartDL:0}
2023/10/07 17:42:25 EBPF: Put PDR Downlink: ipv4=10.46.0.3, pdrInfo={OuterHeaderRemoval:0 FarId:3 QerId:1 SdfFilter:<nil>}
2023/10/07 17:42:25 EBPF: Put PDR Uplink: teid=6, pdrInfo={OuterHeaderRemoval:0 FarId:4 QerId:1 SdfFilter:<nil>}
2023/10/07 17:42:25 EBPF: Put PDR Uplink: teid=7, pdrInfo={OuterHeaderRemoval:0 FarId:3 QerId:1 SdfFilter:<nil>}
2023/10/07 17:42:25 Error extracting PDR info: SDF Filter: bad formatting. Should be compatible with regexp: ^permit out (icmp|ip|tcp|udp) from (any|[\d.]+|[\da-fA-F:]+)(?:/(\d+))?(?: (\d+|\d+-\d+))? to ([\d.]+|[\da-fA-F:]+)(?:/(\d+))?(?: (\d+|\d+-\d+))?$
2023/10/07 17:42:25 Session Establishment Request from 10.233.64.21 accepted.
2023/10/07 17:42:25 Received 70 bytes from 10.233.64.21:8805
2023/10/07 17:42:25 Handling PFCP message from 10.233.64.21:8805
2023/10/07 17:42:25 Got Session Modification Request from: 10.233.64.21. 
2023/10/07 17:42:25 Finding association for 10.233.64.21
2023/10/07 17:42:25 Finding session 3
2023/10/07 17:42:25 
Session Modification Request:
  UpdateFAR ID: 1 
    Apply Action: [2 0] 
    Update forwarding Parameters:
      Network Instance: internet 
      Outer Header Creation: &{OuterHeaderCreationDescription:256 TEID:1 IPv4Address:10.233.64.39 IPv6Address:<nil> PortNumber:0 CTag:0 STag:0} 
2023/10/07 17:42:25 Updating FAR info: 1, {FarInfo:{Action:2 OuterHeaderCreation:1 Teid:1 RemoteIP:658565386 LocalIP:507570442 TransportLevelMarking:0} GlobalId:3}
2023/10/07 17:42:25 EBPF: Update FAR: internalId=3, farInfo={Action:2 OuterHeaderCreation:1 Teid:1 RemoteIP:658565386 LocalIP:507570442 TransportLevelMarking:0}
2023/10/07 17:42:26 Received 16 bytes from 10.233.64.21:8805
2023/10/07 17:42:26 Handling PFCP message from 10.233.64.21:8805
2023/10/07 17:42:26 Got Heartbeat Request with TS: 2023-10-04 09:52:23 +0000 UTC, from: 10.233.64.21
2023/10/07 17:42:26 Sent Heartbeat Response to: 10.233.64.21
``` 

UE <<K9s-Shell>> Pod: open5gslice/srsran-srs-lte-0 | Container: ue
```ruby
root@srsran-srs-lte-0:/# ip a
1: lo: <LOOPBACK,UP,LOWER_UP> mtu 65536 qdisc noqueue state UNKNOWN group default qlen 1000
    link/loopback 00:00:00:00:00:00 brd 00:00:00:00:00:00
    inet 127.0.0.1/8 scope host lo
       valid_lft forever preferred_lft forever
    inet6 ::1/128 scope host
       valid_lft forever preferred_lft forever
2: ip_vti0@NONE: <NOARP> mtu 1480 qdisc noop state DOWN group default qlen 1000
    link/ipip 0.0.0.0 brd 0.0.0.0
4: eth0@if4515: <BROADCAST,MULTICAST,UP,LOWER_UP> mtu 1500 qdisc noqueue state UP group default
    link/ether a6:22:8c:8d:2a:6e brd ff:ff:ff:ff:ff:ff link-netnsid 0
    inet 10.233.64.39/32 scope global eth0
       valid_lft forever preferred_lft forever
    inet6 fe80::a422:8cff:fe8d:2a6e/64 scope link
       valid_lft forever preferred_lft forever
5: tun_srsue: <POINTOPOINT,MULTICAST,NOARP,UP,LOWER_UP> mtu 1500 qdisc fq_codel state UNKNOWN group default qlen 500
    link/none
    inet 10.46.0.3/24 scope global tun_srsue
       valid_lft forever preferred_lft forever
root@srsran-srs-lte-0:/# ping -I tun_srsue 10.233.64.1  -RAc 5
PING 10.233.64.1 (10.233.64.1) from 10.46.0.3 tun_srsue: 56(124) bytes of data.

--- 10.233.64.1 ping statistics ---
5 packets transmitted, 0 received, 100% packet loss, time 4001ms

``` 

</p>
</details>

**Comment by pirog-spb** [comment]
The reason is gNB needs GTP Extention Header in GTP-U:
```
2023-10-21T15:20:18.790644 [GTPU    ] [W] ue=0 DL teid=0x000001: Incomplete PDU at NG-U interface: missing or invalid PDU session container. pdu_len=92 teid=0x000001
```

**Comment by pirog-spb** [comment]
After GTP header extention has been added srsRAN work fine
